{
  "id": "WP-006",
  "status": "complete",
  "starting_commit": "086b243",
  "branch": "codex/wp-006-validated-protocol",
  "initial_worktree": "clean",
  "starting_lock_sha256": "2F43857E260A08457E52C14251C3F3CE1F8BA11B5FA3D56210E08C1B2997D0C3",
  "owning_roles": [
    "worms_port_network_worker",
    "worms_port_test_worker"
  ],
  "scope": [
    "Runtime-validated session, challenge, command, snapshot, acknowledgement, error, and result schemas",
    "Opaque server-issued session tokens replacing caller-supplied Socket.IO identity",
    "Origin, payload-size, rate, timeout, teardown, and replay guards",
    "Schema, malformed-input, event-flood, and real Socket.IO client protocol tests"
  ],
  "non_goals": [
    "Deterministic artillery simulation",
    "Loomkeeper AI",
    "Nimiq Pay SDK or real wallet signatures",
    "Reward reservation or payout",
    "Gameplay UI changes"
  ],
  "planned_checks": [
    "npm run check:compliance",
    "npm run check:types",
    "npm run test:tooling",
    "npm run test:protocol",
    "npm run build",
    "npm run smoke:built",
    "npm run test:browser:smoke",
    "npm audit",
    "read-only review"
  ],
  "deterministic_seeds": [],
  "sorcerers_reference_used": false,
  "clean_room_records": [],
  "check_results": [
    { "command": "npm run check:compliance", "status": "pass" },
    { "command": "npm run check:types", "status": "pass" },
    { "command": "npm run test:tooling", "status": "pass" },
    { "command": "npm run test:protocol", "status": "pass" },
    { "command": "npm run build", "status": "pass" },
    { "command": "npm run smoke:built", "status": "pass" },
    { "command": "npm run test:browser:smoke", "status": "pass" },
    { "command": "npm audit", "status": "pass" },
    { "command": "read-only review", "status": "pass" }
  ],
  "reviews": [
    { "role": "worms_port_network_worker", "reviewer": "wp006_network", "decision": "pass" },
    { "role": "worms_port_test_worker", "reviewer": "wp005_test", "decision": "pass" },
    { "role": "worms_port_reviewer", "reviewer": "wp005_reviewer", "decision": "pass" }
  ],
  "skipped_checks": [
    "Physical Android and iOS testing: no release-testing environment was provided.",
    "Nimiq Pay WebView and real wallet-provider testing: deferred to the external release environment and WP-012."
  ],
  "residual_risks": [
    "The bearer token remains readable by same-origin script, so CSP and XSS hardening remain required before production deployment.",
    "An acknowledgement lost during initial anonymous session creation is not automatically recovered; rotation acknowledgement loss is covered.",
    "Phone Chromium/WebKit projects emulate mobile browsers but cannot prove physical Nimiq Pay WebView behavior.",
    "The client bundle remains approximately 1.34 MB minified and 370 kB gzip and emits the existing chunk-size warning."
  ]
}
