{
  "id": "WP-011C",
  "status": "complete",
  "starting_commit": "a7f66c31fe77f20932f2dbe2c825cbfa6f93f742",
  "branch": "codex/wp-011c-sideways-mode",
  "initial_worktree": "clean",
  "starting_lock_sha256": "98951A0DECBB8FF685BD314AD44C853ED91554FFC46565BBDD03A27AB78A04AE",
  "owning_roles": [
    "worms_port_base_game_worker",
    "worms_port_test_worker",
    "worms_port_reviewer"
  ],
  "scope": [
    "Remove orientation locking from standard browser full-screen entry",
    "Keep a state-aware full-screen/default-screen toggle available on terminal results",
    "Offer opt-in clockwise and counter-clockwise virtual landscape in a portrait browser viewport",
    "Swap Phaser logical dimensions, remap safe-area edges, and inverse-map touch coordinates while sideways",
    "Automatically deactivate sideways transforms when the browser viewport actually becomes landscape",
    "Record the Samsung Galaxy S22 Nimiq Pay auto-rotate-off precondition and deployed acceptance"
  ],
  "non_goals": [
    "Changing Android auto-rotate or reliably detecting physical device attitude from web content",
    "Forcing Nimiq Pay native URL or Android system chrome to disappear",
    "Undocumented Nimiq Pay APIs, native application changes, or a native wrapper",
    "Making sideways presentation the default for every player",
    "Gameplay authority, simulation, Loomkeeper, Relic, reward, or wallet changes",
    "New third-party dependencies or product assets"
  ],
  "planned_checks": [
    "npm run check:compliance",
    "npm run check:types",
    "npm run test:combat",
    "npm run test:practice",
    "npm run build",
    "npm run smoke:built",
    "npm run test:browser:smoke",
    "npm run test:browser:combat",
    "npm run test:browser:practice",
    "npm audit",
    "self-review",
    "Samsung Galaxy S22 Chrome and Nimiq Pay acceptance"
  ],
  "deterministic_seeds": [],
  "sorcerers_reference_used": false,
  "clean_room_records": [],
  "check_results": [
    { "command": "npm run check:compliance", "status": "pass" },
    { "command": "npm run check:types", "status": "pass" },
    { "command": "npm run test:combat", "status": "pass" },
    { "command": "npm run test:practice", "status": "pass" },
    { "command": "npm run build", "status": "pass" },
    { "command": "npm run smoke:built", "status": "pass" },
    { "command": "npm run test:browser:smoke", "status": "pass" },
    { "command": "npm run test:browser:combat", "status": "pass" },
    { "command": "npm run test:browser:practice", "status": "pass" },
    { "command": "npm audit", "status": "pass" },
    { "command": "self-review", "status": "pass" },
    { "command": "Samsung Galaxy S22 Chrome and Nimiq Pay acceptance", "status": "pass" }
  ],
  "reviews": [
    { "role": "worms_port_base_game_worker", "reviewer": "primary-agent-client-review", "decision": "pass" },
    { "role": "worms_port_test_worker", "reviewer": "primary-agent-test-review", "decision": "pass" },
    { "role": "worms_port_reviewer", "reviewer": "primary-agent-boundary-review", "decision": "pass" }
  ],
  "skipped_checks": [
    "Physical Android and iOS coverage beyond the Samsung device: no release-testing environment was provided.",
    "WP-014 visual-regression baselines, expanded device matrix, degraded-network matrix, and performance budgets are not yet available."
  ],
  "residual_risks": [
    "Samsung Galaxy S22 Nimiq Pay acceptance passed on 2026-07-21, but one device and WebView version does not establish wider Android or iOS coverage.",
    "Sideways mode relies on the user disabling Android auto-rotate while portrait and selecting the matching device-hold direction.",
    "Viewport orientation cannot prove physical phone attitude; WP-011C therefore shipped explicit queries, which WP-011D later supersedes with a documented temporary default and opt-out.",
    "Nimiq Pay still controls its native URL ribbon and Android system chrome; this compatibility mode uses the remaining viewport but cannot hide those surfaces.",
    "The client bundle is approximately 1.406 MB minified and 387.72 kB gzip and retains the existing chunk-size warning."
  ]
}
