{
  "id": "WP-005",
  "status": "complete",
  "starting_commit": "d387b38",
  "branch": "codex/wp-005-autonomous-foundation",
  "initial_worktree": "clean",
  "starting_lock_sha256": "EB1B58387E1E1575266C7D5853C80D750E6C5ADAA5946B28C1BD54B2F3AF7DB7",
  "owning_roles": [
    "worms_port_planner",
    "worms_port_test_worker",
    "worms_port_compliance_keeper",
    "worms_port_docs_keeper"
  ],
  "scope": [
    "Executable evidence and clean-room gates",
    "Stronger import-boundary scanning",
    "Manifest-aware approved-asset build plumbing",
    "Fresh-build server and phone-browser smoke tests",
    "Continuous integration verification"
  ],
  "non_goals": [
    "Gameplay behavior",
    "Wallet or reward integration",
    "Production art or audio",
    "PvP or matchmaking changes"
  ],
  "planned_checks": [
    "npm run check:compliance",
    "npm run check:types",
    "npm run test:tooling",
    "npm run build",
    "npm audit",
    "npm run smoke:built",
    "npm ls @playwright/test --depth=0",
    "npx playwright --version",
    "npm run test:browser:smoke",
    "PLAYWRIGHT_ARTIFACT_PROBE=1 intentional failure",
    "read-only review"
  ],
  "deterministic_seeds": [],
  "sorcerers_reference_used": false,
  "clean_room_records": [],
  "check_results": [
    { "command": "npm run check:compliance", "status": "pass" },
    { "command": "npm run check:types", "status": "pass" },
    { "command": "npm run test:tooling", "status": "pass" },
    { "command": "npm run build", "status": "pass" },
    { "command": "npm audit", "status": "pass" },
    { "command": "npm run smoke:built", "status": "pass" },
    { "command": "npm ls @playwright/test --depth=0", "status": "pass" },
    { "command": "npx playwright --version", "status": "pass" },
    { "command": "npm run test:browser:smoke", "status": "pass" },
    { "command": "PLAYWRIGHT_ARTIFACT_PROBE=1 intentional failure", "status": "pass" },
    { "command": "read-only review", "status": "pass" }
  ],
  "reviews": [
    { "role": "worms_port_test_worker", "reviewer": "wp005_test", "decision": "pass" },
    { "role": "worms_port_compliance_keeper", "reviewer": "wp005_compliance", "decision": "pass" },
    { "role": "worms_port_reviewer", "reviewer": "wp005_reviewer", "decision": "pass" }
  ],
  "skipped_checks": [
    "Physical Android and iOS testing: no release-testing environment was provided.",
    "Nimiq Pay WebView and allowlisted wallet-provider testing: deferred to the external release environment and WP-011."
  ],
  "residual_risks": [
    "Browser phone projects emulate Chromium and WebKit but cannot prove physical Nimiq Pay WebView behavior.",
    "The current client bundle emits a 500 kB chunk-size warning at approximately 1.265 MB minified and 350 kB gzip.",
    "Automated import and clean-room gates support but do not replace human similarity review."
  ]
}
