{
  "id": "WP-014B",
  "status": "in_progress",
  "starting_commit": "096a4c71c657a73aaf78674d6d6ac64d0fc6f2e3",
  "branch": "codex/wp-014-quality-harness",
  "initial_worktree": "clean",
  "starting_lock_sha256": "8A13522641DC030E38258E08B843B1E902B018E324D3AEECA3CD577F0EF10704",
  "owning_roles": [
    "worms_port_test_worker",
    "worms_port_base_game_worker",
    "worms_port_reviewer",
    "worms_port_compliance_keeper"
  ],
  "scope": [
    "Add Linux Playwright screenshot assertions at the frozen 0.2 per-pixel and 0.005 ratio thresholds",
    "Cover deterministic start, combat, and result geometry at all five maintained projects",
    "Cover canonical aim lock, Relic chooser, pause, reduced and full motion, projectile and impact presentation, and all three sideways modes",
    "Cover canonical Daily availability, authorization, claim processing, and finalized wording with a synthetic wallet and record-only boundary",
    "Cover compact-landscape Pause and standards-based full-screen fallback presentation",
    "Enforce action and pad target sizes, control separation, exact status values, non-color state, safe-area containment, and browser scroll, zoom, and selection suppression",
    "Provide a deterministic result preview and recovery fixture for visual capture without external wallet, database, RPC, or chain authority",
    "Integrate the visual suite into the maintained zero-retry quality matrix and reviewed expected-skip policy"
  ],
  "non_goals": [
    "Network degradation, delayed providers, session loss, or multi-context isolation assigned to WP-014C",
    "PostgreSQL races, restart injection, fake signer or RPC faults, and artifact secret scanning assigned to WP-014D",
    "Bundle and timing budgets or verify:full closure assigned to WP-014E",
    "Real Nimiq Pay, physical Android or iOS, real wallets, external RPCs, NIM transfers, production art or audio, PvP, matchmaking, or Sorcerers material",
    "Automatic acceptance of changed screenshot baselines or increased visual thresholds"
  ],
  "planned_checks": [
    "npm run check:compliance",
    "npm run check:types",
    "npm run test:tooling",
    "npm run test:combat",
    "npm run build",
    "npm run smoke:built",
    "npm run test:browser:visual",
    "npm run test:browser:matrix",
    "npm audit",
    "Linux screenshot baseline review",
    "GitHub Actions visual comparison",
    "self-review"
  ],
  "deterministic_seeds": [
    "1",
    "3735928559"
  ],
  "sorcerers_reference_used": false,
  "clean_room_records": [],
  "check_results": [
    { "command": "npm run check:compliance", "status": "pass", "detail": "All 16 work-package records and asset, import-boundary, dependency-license, and clean-room gates passed." },
    { "command": "npm run check:types", "status": "pass" },
    { "command": "npm run test:tooling", "status": "pass", "detail": "10 tests passed." },
    { "command": "npm run test:combat", "status": "pass", "detail": "18 tests passed." },
    { "command": "npm run build", "status": "pass", "detail": "Production server and client builds passed; the existing large-client-chunk warning remains assigned to WP-014E." },
    { "command": "npm run smoke:built", "status": "pass" },
    { "command": "GitHub Actions Visual baseline candidates run 30714882370", "status": "pass", "detail": "Ubuntu 24.04 capture completed in 4m48s and uploaded 35 PNG candidates. Explicit review rejected the initial set because the portrait aim-pad hint clipped at the right edge; none of those candidates were committed." },
    { "command": "node scripts/run-playwright.js tests/browser/visual.spec.ts --ignore-snapshots --grep visual-geometry-baselines", "status": "pass", "detail": "The corrective pad-label rendered-width assertion passed all five maintained projects: 5 passed in 39.9 seconds." },
    { "command": "GitHub Actions Visual baseline candidates run 30715750959", "status": "pass", "detail": "Commit f553b6aaca923dca857d2eed1f2889a16194577d on Ubuntu 24.04 uploaded 35 PNGs without Actions runtime warnings. Explicit review approved every frame: 16 unaffected frames were byte-identical to the initial capture and all 19 corrected combat/pause frames showed the complete aim hint." },
    { "command": "npm audit", "status": "pass", "detail": "0 vulnerabilities" }
  ],
  "reviews": [
    { "role": "worms_port_test_worker", "reviewer": "primary-agent-pre-baseline-matrix-review", "decision": "pass" },
    { "role": "worms_port_base_game_worker", "reviewer": "primary-agent-labeled-preview-and-recovery-review", "decision": "pass" },
    { "role": "worms_port_compliance_keeper", "reviewer": "primary-agent-synthetic-authority-and-artifact-boundary-review", "decision": "pass" },
    { "role": "worms_port_reviewer", "reviewer": "primary-agent-linux-baseline-visual-review", "decision": "pass" }
  ],
  "skipped_checks": [
    "The reviewed Linux baselines now exist locally, but exact npm run test:browser:visual and npm run test:browser:matrix comparison remain pending until the baseline commit is pushed and ordinary Ubuntu 24.04 CI consumes it. The earlier Windows logic preflight passed 8 applicable visual journeys with 12 reviewed exclusions, and the zero-retry quality preflight passed all 125 project results with screenshots ignored: 86 passed and 39 reviewed exclusions.",
    "The isolated Ubuntu 24.04 WSL copy downloaded the pinned browsers but could not run them because WebKit requires system packages and WSL sudo needs user interaction. No WSL image is being treated as release evidence.",
    "The first GitHub Actions candidate generation passed, but its 35-image set was rejected because the portrait aim-pad hint clipped. Verify run 30714882362 then reached result 119 of 125 with every preceding CI step green before GitHub canceled the job at its 20-minute ceiling. The corrective copy, rendered-width assertion, Node 24 Actions upgrades, and evidence-based 30-minute ceiling are now on the PR; replacement candidate run 30715750959 passed review, while ordinary baseline comparison awaits the baseline commit.",
    "Physical Android/iOS and Nimiq Pay WebView testing was not run; browser emulation and synthetic safe areas do not substitute for it."
  ],
  "residual_risks": [
    "The 35 reviewed Ubuntu 24.04 screenshot baselines still require a clean ordinary comparison run before WP-014B can close.",
    "The query-only deterministic result preview is visibly labeled as an automated no-wallet/no-payout surface and contains no external authority; it still ships in the client bundle as a capture helper.",
    "Synthetic safe-area and browser emulation cannot prove physical Nimiq Pay chrome, notch, or device font behavior."
  ]
}
