{
  "id": "WP-014G",
  "status": "complete",
  "starting_commit": "bb111c4ed040a35368bb3ebb18aa1e7279559f4c",
  "branch": "codex/wp-014g-browser-harness-optimization-v0",
  "initial_worktree": "clean",
  "starting_lock_sha256": "D4DAC6AE09A3D2F6C5A7EAA11520BAC43F1628320C5331575BCF1E1857073D73",
  "owning_roles": [
    "worms_port_test_worker",
    "worms_port_docs_keeper",
    "worms_port_reviewer"
  ],
  "scope": [
    "Keep the complete five-project, zero-retry, one-worker WP-014 quality verdict unchanged while reducing repeated local browser-test setup cost.",
    "Move reviewed project eligibility ahead of shared combat and Practice navigation so excluded project results remain accounted for without opening pages or sockets.",
    "Write and verify a deterministic production-build proof over declared build inputs and exact client/server outputs, and rebuild automatically whenever that proof is absent or stale.",
    "Let focused, matrix, and performance browser commands reuse only a verified build; retain fresh-build behavior on a cache miss and preserve CI project sharding.",
    "Document a fail-fast local development funnel and guard quality/performance worker settings from accidental parallel overrides.",
    "Limit tracked outputs to README.md, docs/planning/implementation_plan.md, docs/process/development_workflow.md, docs/evidence/wp-014g.json, package.json, scripts/build-proof.js, scripts/build-and-start-test-server.js, scripts/run-playwright.js, tests/browser/support/project-routing.ts, tests/browser/combat.spec.ts, tests/browser/practice.spec.ts, tests/tooling/browser-build-proof.test.js, tests/tooling/browser-build-environment.test.js, and tests/tooling/playwright-quality-policy.test.js."
  ],
  "non_goals": [
    "No gameplay, simulation, client, server, protocol, reward, authority, asset, dependency, package-lock, schema, executor, visual-baseline, threshold, retry, maintained-project, or expected-skip policy change.",
    "No player observation, Lane G execution, Lane M work, Stage C aggregate execution or repair, ProductAuthority, mathematical placement, P5, or landfall claim.",
    "No Sorcerers inspection or material, real wallet, external RPC, chain transaction, physical-device session, deployment, or marketing claim."
  ],
  "planned_checks": [
    "pre-edit npm run test:tooling",
    "npm run check:compliance",
    "npm run check:types",
    "npm run test:tooling",
    "npm run build",
    "verified-build hit and source/output invalidation probes",
    "npm run smoke:built",
    "focused combat and Practice project-routing checks",
    "npm run test:browser:matrix",
    "npm run test:browser:performance",
    "npm audit",
    "git diff --check and scoped self-review"
  ],
  "deterministic_seeds": [
    "1",
    "3735928559"
  ],
  "sorcerers_reference_used": false,
  "clean_room_records": [],
  "check_results": [
    {
      "command": "pre-edit npm run test:tooling",
      "status": "pass",
      "detail": "All 62 tooling tests passed at the exact clean starting commit in 1.34 seconds. The immediately preceding V6 completion at the same commit also records a green 175-result browser matrix."
    },
    {
      "command": "npm run check:compliance",
      "status": "pass",
      "detail": "All asset, runtime-inventory, generation-component, import-boundary, package-license, work-package, and clean-room gates passed with the completed WP-014G evidence."
    },
    {
      "command": "npm run check:types",
      "status": "pass",
      "detail": "Client and server TypeScript checks passed without emitting output."
    },
    {
      "command": "npm run build",
      "status": "pass",
      "detail": "The final production build passed all compliance and client/server type gates, produced the unchanged 1,464,067-byte largest client JavaScript chunk, copied the exact eleven approved runtime assets, and wrote a deterministic build proof over declared inputs and exact outputs."
    },
    {
      "command": "npm run test:tooling",
      "status": "pass",
      "detail": "All 68 tooling tests passed, including exact proof hits, source/lock invalidation, output invalidation, malformed-proof cache misses, quality-policy routing, and long/short worker-override rejection."
    },
    {
      "command": "verified-build hit and source/output invalidation probes",
      "status": "pass",
      "detail": "The repository build returned an exact verified hit; temporary deterministic fixtures rejected changed source, lockfile, output, and malformed proof data. After package input changed, the next focused run rebuilt automatically and passed in 50.8 seconds; the immediate unchanged rerun reused the proof and passed in 31.9 seconds."
    },
    {
      "command": "npm run smoke:built",
      "status": "pass",
      "detail": "The built server, page, overlays, approved-asset plumbing, and room join-ID route passed on an ephemeral loopback port."
    },
    {
      "command": "focused combat and Practice project-routing checks",
      "status": "pass",
      "detail": "A policy-excluded combat route on chromium-412x915 produced one recorded skip in 2.6 seconds before shared navigation. The final five-case canonical focused gate passed from the exact verified build in 32.5 seconds."
    },
    {
      "command": "npm run test:browser:matrix",
      "status": "pass",
      "detail": "The unchanged five-project, one-worker, zero-retry policy accounted for all 175 results: 103 passed and 72 approved skips in 10.7 minutes, versus 11.3 minutes at the starting V6 commit. No Windows socket-exhaustion failure recurred."
    },
    {
      "command": "npm run test:browser:performance",
      "status": "pass",
      "detail": "The verified-build performance gate passed in 53.0 seconds. The bundle gate passed at 1,464,067/1,500,000 raw JavaScript bytes and 405,330/430,000 initial gzip bytes."
    },
    {
      "command": "npm audit",
      "status": "pass",
      "detail": "0 vulnerabilities. package-lock.json and all dependency identities remained unchanged."
    },
    {
      "command": "git diff --check and scoped self-review",
      "status": "pass",
      "detail": "The final tracked path set matches the declared allowlist. Review confirmed no gameplay, runtime rule, authority, asset, dependency, expected-skip, project, retry, visual-threshold, or timing-budget change; git diff whitespace validation passed."
    }
  ],
  "reviews": [
    {
      "role": "worms_port_reviewer",
      "reviewer": "Codex primary-agent scoped harness review",
      "decision": "pass",
      "detail": "Reviewed deterministic input/output proofing, automatic cache misses, route-policy reuse, worker guards, unchanged quality accounting, exact output scope, and import/authority boundaries."
    }
  ],
  "skipped_checks": [
    "The full verify:fast aggregate was not rerun because no gameplay, simulation, protocol, client, server, identity, or reward implementation changed; its relevant compliance, type, tooling, build, smoke, and browser surfaces were run directly.",
    "Linux visual comparison was omitted by the existing Windows quality policy; no visual source, threshold, or baseline changed, and authoritative Ubuntu comparison remains in CI.",
    "Physical Android/iOS and Nimiq Pay WebView testing was not run because this is a local browser-harness tooling slice."
  ],
  "residual_risks": [
    "Build-proof reuse intentionally optimizes only unchanged declared inputs and exact outputs; the first browser run after any relevant change still pays the full production-build cost.",
    "The quality gate remains serial inside each existing CI project shard because local Windows socket exhaustion makes unbounded worker parallelism an unsafe default.",
    "Physical Android/iOS and Nimiq Pay WebView behavior remain outside automated browser evidence."
  ]
}
